{
  "$id": "https://commandlayer.org/schemas/v1.1.0/commercial/authorize/authorize.receipt.schema.json",
  "$schema": "https://json-schema.org/draft/2020-12/schema",
  "title": "authorize.receipt",
  "description": "Canonical authorization outcome artifact for a commercial authorize request.",
  "type": "object",
  "additionalProperties": false,
  "$defs": {
    "money": {
      "type": "object",
      "additionalProperties": false,
      "required": [
        "amount",
        "currency"
      ],
      "properties": {
        "amount": {
          "type": "string",
          "pattern": "^(0|[1-9][0-9]*)(\\.[0-9]{1,6})?$",
          "maxLength": 40
        },
        "currency": {
          "type": "string",
          "pattern": "^[A-Z0-9]{2,16}$"
        },
        "decimals": {
          "type": "integer",
          "minimum": 0,
          "maximum": 18
        },
        "includes": {
          "type": "string",
          "enum": [
            "subtotal",
            "tax",
            "shipping",
            "fees",
            "discount",
            "total"
          ]
        }
      }
    },
    "actor": {
      "type": "object",
      "additionalProperties": false,
      "required": [
        "role",
        "id"
      ],
      "properties": {
        "role": {
          "type": "string",
          "enum": [
            "payer",
            "payee",
            "merchant",
            "provider",
            "marketplace",
            "counterparty",
            "carrier",
            "verifier"
          ]
        },
        "id": {
          "type": "string",
          "minLength": 1,
          "maxLength": 128
        },
        "kind": {
          "type": "string",
          "enum": [
            "agent",
            "organization",
            "wallet",
            "account",
            "service",
            "human"
          ]
        },
        "display_name": {
          "type": "string",
          "maxLength": 128
        },
        "uri": {
          "type": "string",
          "format": "uri",
          "maxLength": 512
        }
      }
    },
    "reference": {
      "type": "object",
      "additionalProperties": false,
      "required": [
        "type",
        "id"
      ],
      "properties": {
        "type": {
          "type": "string",
          "enum": [
            "order",
            "invoice",
            "authorization",
            "checkout",
            "purchase",
            "shipment",
            "payment",
            "settlement",
            "receipt",
            "payment_requirement",
            "payment_session",
            "proof",
            "agent_card"
          ]
        },
        "id": {
          "type": "string",
          "minLength": 1,
          "maxLength": 128
        },
        "uri": {
          "type": "string",
          "format": "uri",
          "maxLength": 512
        }
      }
    },
    "x402_proof": {
      "type": "object",
      "additionalProperties": false,
      "required": [
        "scheme",
        "proof_type",
        "proof_ref"
      ],
      "properties": {
        "scheme": {
          "type": "string",
          "const": "x402"
        },
        "proof_type": {
          "type": "string",
          "enum": [
            "payment-session",
            "payment-authorization",
            "payment-proof"
          ]
        },
        "proof_ref": {
          "type": "string",
          "minLength": 1,
          "maxLength": 128
        },
        "uri": {
          "type": "string",
          "format": "uri",
          "maxLength": 512
        }
      }
    }
  },
  "properties": {
    "protocol": {
      "type": "string",
      "const": "commercial"
    },
    "version": {
      "type": "string",
      "const": "1.1.0"
    },
    "verb": {
      "type": "string",
      "const": "authorize"
    },
    "receipt_id": {
      "type": "string",
      "minLength": 1,
      "maxLength": 128
    },
    "issued_at": {
      "type": "string",
      "format": "date-time"
    },
    "request_id": {
      "type": "string",
      "minLength": 1,
      "maxLength": 128
    },
    "status": {
      "type": "string",
      "enum": [
        "approved",
        "denied",
        "pending"
      ]
    },
    "authorization_id": {
      "type": "string",
      "minLength": 1,
      "maxLength": 128
    },
    "payer": {
      "$ref": "#/$defs/actor"
    },
    "payee": {
      "$ref": "#/$defs/actor"
    },
    "amount": {
      "$ref": "#/$defs/money"
    },
    "approved_until": {
      "type": "string",
      "format": "date-time"
    },
    "settlement_precondition_ref": {
      "$ref": "#/$defs/reference"
    },
    "order_ref": {
      "$ref": "#/$defs/reference"
    },
    "invoice_ref": {
      "$ref": "#/$defs/reference"
    },
    "payment_proof": {
      "$ref": "#/$defs/x402_proof"
    },
    "reason": {
      "type": "string",
      "maxLength": 512
    }
  },
  "required": [
    "protocol",
    "version",
    "verb",
    "receipt_id",
    "issued_at",
    "request_id",
    "status",
    "authorization_id",
    "payer",
    "payee",
    "amount"
  ],
  "allOf": [
    {
      "if": {
        "properties": {
          "status": {
            "const": "approved"
          }
        }
      },
      "then": {
        "properties": {
          "approved_until": {
            "type": "string",
            "format": "date-time"
          }
        },
        "required": [
          "approved_until"
        ]
      }
    },
    {
      "if": {
        "properties": {
          "status": {
            "enum": [
              "denied",
              "pending"
            ]
          }
        }
      },
      "then": {
        "properties": {
          "reason": {
            "type": "string",
            "maxLength": 512
          }
        },
        "required": [
          "reason"
        ]
      }
    }
  ]
}
