{
  "protocol": "commercial",
  "version": "1.1.0",
  "verb": "authorize",
  "receipt_id": "authrcpt-002",
  "issued_at": "2026-03-19T10:30:05Z",
  "request_id": "authreq-002",
  "status": "pending",
  "authorization_id": "auth-002",
  "payer": {
    "role": "payer",
    "id": "buyer-escrow-002",
    "kind": "wallet"
  },
  "payee": {
    "role": "payee",
    "id": "merchant-treasury",
    "kind": "wallet"
  },
  "amount": {
    "amount": "250.00",
    "currency": "USDC",
    "decimals": 2
  },
  "reason": "Issuer challenge remains open for asynchronous approval."
}
